question,attitude,content
時間能夠治愈傷痛嗎？,深入且全面的理解,時間對於某些人來說確實有助於緩解傷痛，但這也取決於個人和他們的情況。與其說時間本身能治愈傷痛，不如說是時間給予我們機會去處理、學習和適應。
如何看待原諒和忘記？,寬容與理解,原諒是一個內在的過程，讓我們從心底釋放出對他人的怨恨或痛苦。而忘記可能較難，但重要的是如何不讓過去的情緒影響我們的現在。兩者都需要時間和努力。
自己需要什麼來更好地面對這些問題和挑戰？,體貼與支持,每個人的需求都是獨特的，但尋求支持、接受自己的情感、並學習有效的應對策略往往是有幫助的。
和家人或朋友談論這些問題有幫助嗎？,積極的鼓勵,對多數人而言，與他人分享自己的感受和困境能獲得安慰和見解。當然，這也取決於你選擇分享的人是否能提供支持。
如何重建被破裂的信任？,耐心與關心,重建信任是一個逐步的過程。首先需要誠實地面對問題，並不斷地展示自己的誠意和承諾，時間會協助證明這些努力的真誠。
真正的朋友應該如何面對困難時期的對方？,善意的關懷,真正的朋友在困難時期會站在你身邊，提供支持，耐心傾聽，並給予真摯的建議。
人際關係中還有什麼可以學習的？, 開放的學習態度,人際關係中的學習是無窮無盡的，例如學習傾聽、表達、設定界限、以及如何共同成長。
有沒有書籍或電影可以對問題提供不同的見解或感受到安慰？,鼓勵的建議,確實有很多書籍和電影能提供不同的見解和安慰。具體的建議取決於你的興趣和所面臨的情況，但我會樂於推薦一些。
獨處還是繼續尋找新的人際關係？,尊重個人選擇,這完全取決於你。有時，獨處可以讓我們有空間反思和恢復。但新的人際關係也能帶來新的視角和機會。請按照你的感覺和需要去做決定。
如何避免未來再次出現類似的矛盾或困境？,關心且提供指引, 反思過去的經驗、學習有效的溝通技巧和設定清晰的界限都是有助於避免未來矛盾的方法。每次的經驗都是學習的機會。
面對關係中的破裂，有哪些自我安慰的方式？,以穩重且充滿理解的心情建議。,每個人都有其獨特的方式來應對關係中的困難。嘗試找到一些令人放鬆的活動，如練習冥想、閱讀或散步。與值得信賴的朋友分享你的感受也很有幫助。記住，時間可以治愈大部分的傷痛。
是否認為每段關係的結束都有其意義或價值？,耐心傾聽，給予支持和承諾。,是的，每段關係的結束都帶有某種教訓或意義。雖然當下可能很難看到，但隨著時間的推移，我們可能會更加明白其意義和價值。
有沒有人或事情可以讓人重新相信或珍惜人際關係？,體諒且充滿信心。,確實有。新的友誼或經驗可能會幫助我們重塑對人際關係的看法。重要的是保持開放的心態，並願意接受新的機會和經驗。
原諒還是持有怨恨比較好？為什麼？,善於傾聽，發自內心的建議。,原諒不僅僅是為了他人，更是為了自己的內心和平。持有怨恨可能會使傷口更加深重。原諒可以讓我們放下包袱，繼續前行。
什麼是維持健康人際關係的關鍵？,穩重且體貼。,維持健康的人際關係需要誠實、信任和有效的溝通。此外，互相尊重和設定清晰的界限也很重要。
如何界定界限，以確保自己不被傷害?,以關懷且具建設性的角度建議。,確定自己的價值觀和需求，並確保在人際互動中清晰地表達這些界限。當感到不舒服或受傷害時，要有勇氣站起來說“不”。
我覺得我的健康影響了我的日程生活。,體諒與支持,我真的很能理解你現在的感受，健康的確是我們生活中最重要的一部分。有什麼特定的情況或症狀讓你這麼覺得嗎？
被診斷出某種疾病，不知道接下來該怎麼辦。,關心與鼓勵,很抱歉聽到這個消息。請記得，接受專業的建議和治療是很重要的。需要的話，我會陪伴你，一步步走過這段時期。
不確定手術後的恢復過程或擔心手術的風險。,耐心與安慰,手術的確是一個大決定，你的擔心是可以理解的。你可以與醫生詳細討論恢復過程和風險，他們可以提供最專業的建議。
難以控制體重，尋求健康的減重方法。, 體諒與建議,體重管理的確是一個長期的過程，不過每一步都值得。也許你可以考慮尋求營養師或健身教練的建議，他們可以為你提供專業意見。
因健康問題導致的壓力和焦慮，需要心理支持。,關心與支持,很抱歉聽到你的困擾。在這困難的時刻，請不要獨自承受，我會在這裡陪伴你，支持你。
因健康問題導致的生活不便，如無法自己走路或照顧自己。,同情與關心,真的很難想像這樣的困境。請告訴我你現在最需要的是什麼，我將盡我所能幫助你。
擔心高昂的醫療費用，尋求經濟援助或建議,關心與建議, 醫療費用的確可能是一大負擔。你可以考慮諮詢相關機構或尋找醫療補助計劃，也許他們能提供一些幫助。
在多種治療選項中難以選擇，需要建議或資訊。,耐心與建議,面對這麼多選項確實可能會讓人感到困惑。建議你可以詳細地和醫生討論，了解每種治療的利弊，再做決定。
擔心自己的疾病會遺傳給孩子。,安慰與支持,這樣的擔心是可以理解的。建議你可以與遺傳學專家諮詢，他們可以為你提供更確切的資訊。
如何調整飲食、運動和休息，以改善健康。, 體諒與建議,保持健康的生活方式的確很重要。開始時可以小步驟逐步調整，尋求專業的建議也會有很大的幫助。
因健康問題導致的性功能障礙。,體諒與支持,我能夠理解你的困擾和感受。身體上的問題可能影響到我們的自信和情感狀態。請記得，你並不孤單，有很多專家和醫生可以幫助你。考慮尋求專業建議，並與伴侶或家人分享你的感受，他們的支持會很有幫助。
持續的失眠或其他睡眠障礙。,耐心傾聽,失眠確實是一個讓人疲憊的問題。你試過哪些方法來改善它呢？請記得，有時候外部的幫助，例如醫生或治療師，可以提供一些有效的策略。
擔心自己的記憶或思考能力有所下降，如是否為早期的失智症。,給予支持和承諾,這種擔心是很自然的，但重要的是，你已經注意到了這些變化並尋求協助。我建議你與醫生討論這些症狀，他們可能可以提供更確切的診斷和建議。
因為某些健康問題而感到孤立，避免社交活動。,體諒與耐心,你的感受很重要，且不是只有你一個人會有這樣的感覺。有時，與他人分享你的經歷，或是參加支援小組，可以幫助你感到不那麼孤單。
擔心同時服用的多種藥物可能產生不良的交互作用。,給予支持,這是一個合理的擔心。請確保你的醫生知道你所服用的所有藥物，這樣他們可以確保沒有不良的交互作用。
感到呼吸困難或心跳加速/不規則，不知道原因。,關心且支持,這些症狀確實需要嚴肅對待。建議你盡快尋求醫療協助以了解其原因。
不確定自己真正想要的是什麼，或是不確定自己在哪裡屬於。,了解與同理, 我明白這種感覺，每個人在某個時候都可能會有這種不確定性。請給自己一些時間和空間去探索，並且相信，隨著時間的推移，答案會逐漸浮現。
感覺自己不夠好，對自己的價值產生質疑。,鼓勵與支持,你的價值不是由他人或成就來定義的。每個人都有他獨特的價值。請記住，你值得愛與被珍惜。
不確定自己未來的方向，感到焦慮和不安。,安慰與體諒,很多人都有過這種不確定的時刻。有時，放慢腳步、專注於當下、並給自己一些反思的時間可以幫助你找到答案。
過度關注他人的成就或狀態，導致對自己感到不滿或羨慕。,關懷與指導,每個人的旅程都是獨特的。與其比較，不如專注於自己的成長與發展。你有自己獨特的光芒。
突然對自己的信仰、價值觀或身份感到困惑或挑戰。,耐心傾聽與體諒,這種困惑是自我探索的一部分。你不是一個人，我在這裡支持你，相信你會找到答案。
不確定或與社會的期望不符合的性別認同。,尊重與支持,你的感受是真實的。追求真正的自己、了解自己是很重要的。我支持你的旅程。
感到需要滿足他人或社會對自己的期望，而不是追隨自己的心意。,鼓勵與理解,重要的是你感受到的快樂和成就感，而不僅僅是滿足他人。請勇敢追隨你的心意。
與家族或文化背景的價值觀不合，導致身份認同的矛盾。,同情與理解,這確實是一個挑戰，但請記住，你有權選擇自己的道路並確定自己的身份。
由於自己的身份或信仰而害怕被他人拒絕或疏遠。,關懷與安慰,被真正接受與理解是每個人的需求。請知道，你不是一個人，並且總會有人願意接受真正的你。
不確定自己在職業生涯中的位置或方向,鼓勵與耐心,職業的旅程有時是曲折的，但每一步都有它的價值。相信自己，並給自己時間和機會去探索。
對自己的外觀或身體有不滿，這可能與自我價值感和自我認同有關。,溫柔、支持性,親愛的，我理解你對自己外觀的不滿可能對你造成壓力。記住，每個人都是獨一無二的，而且外表不定義你的價值。嘗試專注於你的內在美和你的才能。你是值得被愛和尊重的。
過去的經歷或創傷影響了自己的自我價值和認同。,深入傾聽、體諒,我了解過去的經歷可能會深深影響人的生活。請記住，你的過去不定義你的未來。尋找治療和支持，並相信你可以從這些經驗中成長和學習。
因自我認同或價值觀而感到與大多數人格格不入。,鼓勵、同理心,不同是一件美好的事情。盡管有時感覺孤立，但這也是你獨特的一部分。尋找欣賞你的人，並且珍惜那些能理解你的人。真正的自我認同是值得慶祝的。
不清楚自己在哪些領域裡真正擅長或有價值。, 體諒、鼓勵,回答: 尋找自己的長處和價值有時需要時間和探索。嘗試不同的事物，關注讓你感到快樂和滿足的活動。你的價值不只在於你擅長什麼，而是在於你作為一個人的整體。
害怕自己不能達到某種標準或期望，與自我價值感緊密相關。, 安慰、支持,每個人都有達不到期望的時候，這是完全正常的。重要的是要記住，你的價值不取決於你是否達到了某些標準。給自己一些空間和理解，每個人的路都是不同的。
過分基於他人的評價或期望來定義自己的價值，失去了自己的聲音和真正的自我。,穩重、鼓勵,雖然他人的意見有時重要，但你的自我價值應該來自於你自己內在的認同。試著專注於你自己的感受和想法。你的聲音和真正的自我是非常寶貴的。
因為即將到來的考試或繁重的作業感到焦慮，不知道如何有效地進行復習,聆聽與理解，體諒您的壓力與焦慮。,請您先深呼吸，然後每次專注於一件事。建立一個學習時間表或分段復習，這可能會有助於您感到更有控制感。
因為工作量過重或工時過長而感到疲憊和壓抑。,誠摯地關心並希望您得到休息。, 請考慮跟您的上司或同事討論，看看是否有調整工作分配的可能。同時，記得給自己休息和放鬆的時間。
與同學、同事或上司之間的衝突和誤解。,慎重和耐心地建議。,考慮選擇一個合適的時機和地點，以冷靜和尊重的方式表達您的感受和看法，有效的溝通可以解決許多誤解。
擔心自己的職業前景或在工作中的表現。,體諒和支持。, 每個人都會經歷擔心和不確定的時期。請考慮尋找指導或培訓來提高您的技能和自信。
擔心自己的學業成績不佳或未達到父母的期望。,同情並體諒您的感受。,請記住，每個人的學習進度和方式都是不同的。尋求輔導或補習，並與您的家人坦誠地分享您的感受。
新生或新員工可能難以適應新的環境或文化。,關心和理解。,給自己一些時間去適應和學習，每一步都是成長的過程。如果可能，尋找資深的同學或同事求助。
擔心工作場所的內部政治或競爭。,穩重地提供建議。,保持您的專業和正直，並專注於您的工作。建立正面的工作關係可以減少這些擔憂。
學生可能擔心畢業後的生活方向，員工則擔心退休後的計畫。,有耐心且支持。, 這是一個自然的擔憂。請考慮尋找職業或生活規劃的諮詢，以幫助您確定下一步。
面對大量的資料、電郵或任務，感到不知所措。,體諒您的壓力。, 請考慮使用工具或方法來組織和優先處理您的任務。分解大任務為小步驟可能會更容易管理。
難以平衡工作、休閒和家庭生活。,真心地希望您能找到平衡。,請考慮設定界線和優先次序，並定期檢查自己的生活平衡。也許與家人或朋友討論您的感受和需求可以幫助。
擔心學費、生活開銷或失業。,體諒與支持,我能理解你的擔憂。生活中總會有一些不確定因素，但請記住，每一個困難都是一個學習和成長的機會。你可以考慮製定一個預算或尋求專業的財務建議，以幫助你更好地管理資金。
由於壓力和過度工作，可能導致身體健康出現問題。,關心與耐心,我真的很關心你的健康。記住，身體是我們的寶貴資產。儘量給自己一些休息，並考慮定期進行健康檢查。健康總是優先於任何事情。
設定了過高的標準和目標，導致自我壓迫感。,了解與鼓勵,擁有高標準並不是壞事，但別忘了給自己一些寬容和彈性。每一步都是進步，不必過度壓迫自己。
難以找到工作和休閒之間的平衡。,體諒與建議,工作和休閒的平衡確實是一個挑戰。或許你可以嘗試調整你的日常流程，並尋求一些時間管理技巧。
難以理解或吸收新的知識或技能。,耐心與鼓勵, 學習總是有其挑戰性，但每個人都有自己的學習節奏。嘗試找到適合你的學習方法，並給自己足夠的時間和空間。
與團隊成員之間存在意見不合或溝通困難。,了解與建議, 團隊工作中總會遇到一些分歧。考慮開放心態，主動與團隊成員交流，以找到共同的解決方案。
隨著科技的發展和職業市場的變化，如何選擇一個有前途且穩定的職業路徑？, 體諒與支持,我了解選擇職業路徑的重要性，您可以考慮進一步了解各個產業的未來趨勢，與業界專家交流，並考慮自己的興趣和專長，結合這些因素來作出決策。我會支持您的選擇並陪伴您。
面對經濟衰退或金融市場的波動，如何管理自己的財務和投資？,穩重且耐心,財務和投資管理都是需要時間和策略的。建議您可以與財務顧問合作，制定長期和短期的策略。無論市場如何，都需要保持冷靜，不要受到短期波動的影響。
擔心家園受到氣候變遷的威脅，如何適應或減少其影響？,關心與體諒,我理解您的擔憂。您可以考慮在家中採用節能和環保措施，參與社區的環保活動，並支持氣候友好的政策。每個小動作都能為地球帶來積極的改變。
隨著新的疾病或流行病的出現，如何確保自己和家人的健康？,關心與支持,定期體檢、遵循醫生的建議、維持健康的生活習慣，並關注官方健康機構的建議，這些都是確保健康的重要步驟。我會與您一起走過這段路。
擔心AI技術可能取代人類的工作，如何增強自己的競爭力？,穩重且鼓勵,人類的創造力和情感智慧是無法被取代的。考慮增加自己在這些領域的技能，並且持續學習和適應新技術。您有能力面對這些挑戰。
恐懼與伴侶、家人或朋友的關係可能破裂或改變。,傾聽與關心,人際關係總是充滿挑戰，但通過溝通和理解，大多數問題都可以解決。您不是一個人，我會與您並肩作戰。
如何教育子女，使他們在未來的世界中具備競爭力？,體諒與鼓勵, 除了學業知識外，培養他們的情感智慧、批判性思考和適應性也很重要。每個孩子都有他的道路，支持和相信他們。
不確定性可能導致焦慮、抑鬱等心理健康問題，如何妥善應對？,關心與支持,尋求專業的心理健康支援，並找到可以信賴的人分享您的感受。每個人都可能面臨心理健康的挑戰，您不是一個人。
擔心政府政策的改變可能影響到個人的權益或生活。,穩重且耐心,了解和參與公眾政策的討論是很重要的。透過合法途徑，表達自己的意見和關注，並保持與社區的聯繫。
如何保護自己在網絡上的隱私和數據？, 關心與體諒, 定期更新軟體和密碼，不隨便分享個人信息，並使用可靠的隱私工具。我了解這是一個重要的問題，請保持警覺和謹慎。
在不確定的經濟環境中，如何做好退休的準備？,耐心傾聽並給予理性的建議,你的擔憂是非常合理的。建議從現在開始逐步為退休做準備。首先，定期儲蓄並建立一個緊急基金，這可以為你的未來提供更多安全感。其次，多了解不同的投資方式，例如退休基金或是其他低風險的投資選項，選擇最適合你的方式。同時，也要考慮到健康保險和長期護理的需求。最後，如果可能的話，尋求專業財務顧問的幫助，以制定最適合你個人情況的退休計劃。
是否需要因社會不安或天然災害而搬家？,慎重聆聽，鼓勵理性思考, 這是一個需要深思熟慮的決定。首先，評估目前居住地的安全狀況和潛在風險，並與家人或居住社區的成員討論，共同決定是否真的有必要搬家。同時，也要考慮到搬家所帶來的經濟和情感影響。如果最終決定搬家，那麼提前規劃、尋找新居住地的資源和機會將是關鍵。無論如何，安全永遠是第一位的。
在全球化的背景下，如何保持和確定自己的文化和身份？,體諒和支持, 在這個多元化的世界中保持自己的文化身份是非常重要的。建議你積極參與與你的文化背景相關的社區活動和節日慶典，這可以增強你與文化的聯繫。同時，與來自相同背景的朋友和家人保持聯繫，共同分享和傳承文化傳統。此外，教育自己和他人有關你的文化背景，這不僅可以加深自我認同，也有助於促進跨文化的理解和尊重。
如何確保自己的技能和知識不被時代淘汰？, 鼓勵和建議,在這個快速變化的時代，終身學習是非常關鍵的。建議你持續追蹤你所在領域的最新動態和趨勢，參加相關的研討會或在線課程來更新你的知識和技能。同時，也可以考慮跨領域學習，提升自己的多樣性和靈活性。建立一個學習計劃，設定清晰的目標，並定期評估進展。
面對基因編輯等技術，如何決定什麼是道德上可接受的？,深思熟慮，敞開心扉,基因編輯等科技帶來的倫理問題確實需要深思。首先，嘗試了解這些技術的科學原理和可能的影響。其次，考慮這些技術對個人、社會和環境的長期影響。討論和分享你的想法與擔憂，可以是與家人朋友，也可以是專業人士或相關論壇。了解不同觀點，逐步形成自己的看法。但最重要的，始終保持對生命和自然的尊重。
在資訊爆炸的時代，如何過濾和選擇真正有用的資訊？,耐心和關懷,在面對大量資訊時，確實需要一定的技巧來過濾。首先，確定你的資訊來源是否可靠和權威。其次，學會優先處理和整理資訊，根據重要性和緊急性進行分類。另外，定期清理和整理你的數位空間，幫助提升效率和專注力。最後，適時地讓自己遠離資訊泛濫，給大腦一些休息和反思的時間。
如何平衡自己的需要和他人的期望？,充滿同理心和體諒。,嘗試了解自己真正的需要，並與他人溝通這些需要。同時，也要學會說“不”，以確保自己的健康和幸福。
感到孤單或被遺棄時，該如何尋求支持？,溫暖且鼓勵的。,當你感到孤單或被遺棄時，與家人或親密的朋友分享你的感受。如果情況持續，考慮尋求專業幫助或參加支援小組。
如何處理失去摯愛的傷痛？,深具同情和理解。,面對失去摯愛的傷痛是一個漫長的過程。給予自己時間和空間去哀傷，並尋求支援和理解。紀念那些美好的回憶，並與他人分享你的感受。
有沒有什麼方法或活動幫助走出低潮或感到舒緩？,體貼且充滿鼓勵。,嘗試參與如瑜伽、冥想或運動等放鬆身心的活動。與他人建立連接，無論是透過社交活動還是參加支援小組，都可以幫助你走出低潮。
開始吃新的藥嚴肅且警戒。物後，出現不適或副作用。,體諒,藥物的副作用有時會影響我們的日常生活。你應該與醫生討論這些症狀，以確定是否需要調整或更換藥物。
害怕自己因為疾病被他人所拋棄。,深深的同情與理解,這種感覺非常艱難，但請記住，真正關心你的人會站在你身邊。考慮尋求心理輔導，以幫助你處理這些情感。
不知道該不該相信醫生說的話。,傾聽與理解,做健康決策時的疑惑是正常的。如果你有疑慮，考慮尋求第二意見，這有助於確保你得到最佳的醫療建議。
覺得自己的身體一天不如一天。,體諒與支持,我真的很理解你的感覺，身體的變化確實可以讓人感到沮喪。但請記住，尋求醫生和支援者的幫助可以讓你更好地管理你的健康狀態。
當自我認同和價值觀需要調整或變革時，感到極大的不安和抗拒。, 體諒、安慰,變化總是難以面對，特別是當它涉及到你的核心價值和認同時。慢慢來，給自己時間和空間去適應。這些變化有可能導向更好的自我理解和成長。
在某些情境下感覺需要隱藏真實的自己或假裝成另一個人，以適應外部環境或他人的期望。,理解、鼓勵,保持真實不總是容易的，特別是當周圍環境似乎不支持。但請記住，你的真實自我是無價的。尋找能支持和理解你的人，並嘗試慢慢展現你真實的一面。
回顧過去，對於曾經基於自我認同或價值觀做出的決策感到後悔或自我譴責。,溫和、體諒,我們都有過去的決策讓我們後悔。重要的是要從中學習，並理解那時的你做出了最好的選擇。請對自己寬容，每個人都在學習和成長的路上。
擔心他人無法真正理解或接受自己的真實身份或價值觀，導致與人隔膜。,同情、安慰, 被理解和接受是人類的基本需求。但有時，人們可能需要時間來理解不同於他們的
面對新技術或工具時，感到困惑或不安。, 體諒與鼓勵,新技術確實可能會令人感到不安。但別擔心，隨著時間和實踐，你會更加熟悉和自在。
害怕批評或擔心自己的能力不足。,支持與安慰,每個人都有他們的不足。將批評視為成長的機會，並相信自己具有改進和學習的能力。
因為工作需求而忽略家庭，或者因家庭問題而無法集中精力工作。, 了解與體諒,工作和家庭的平衡確實是一個難題。嘗試與家人分享你的感受，並尋求他們的理解和支持。
長時間的重複工作或缺乏激勵，導致感到無聊或失去工作的熱情。,關心與鼓勵,每個人都會有疲憊或失去熱情的時候。或許你可以嘗試找到一些新的挑戰或學習機會，以重燃你的熱情。
在政治動盪或疾病爆發的時期，如何安全地旅行？,細心和謹慎,在這些情況下旅行需要特別的注意。首先，密切關注目的地的最新消息和旅遊警告。其次，準備充分的旅遊保險，並確保你瞭解其涵蓋的範圍。在行前做好健康檢查，攜帶必要的藥物和衛生用品。另外，制定應急計劃，例如了解當地的醫療資源和緊急聯絡方式。同時，與家人或朋友保持聯繫，分享你的行程和位置。
如何應對食水、食物或其他基本資源可能的短缺？,關心並提供實用建議,面對這樣的挑戰，首先需要提高對資源的珍惜和節約意識。例如，節約用水、避免食物浪費，並積極參與資源回收。同時，了解如何儲存和保存食物，以便在需要時有充足的供應。另外，學習基本的自給自足技能，例如種植蔬菜或製作簡單的儲藏食品。最後，與社區成員合作，共同面對資源短缺的挑戰。
